{
  "root": "Utility",
  "quality_attribute_nodes": [
    {
      "attribute_name": "Security",
      "driver_ids": [
        "BD-9"
      ],
      "children": [
        {
          "scenario_id": "RS-1",
          "refinement": "Prevention of unauthorized access",
          "scenario_description": "When a user attempts unauthorized access, the system prevents access to the system.",
          "stimulus": "A user attempts unauthorized access",
          "environment": "During normal system use",
          "response": "The system prevents access to the system",
          "response_measure": null,
          "response_measure_basis": "missing",
          "priority_tuple": null,
          "priority_basis": null,
          "origin": "raw_candidate_scenario",
          "raw_scenario_id": "RS-1",
          "source_refs": [
            "evaluation_inputs.raw_candidate_scenarios[0]"
          ]
        }
      ]
    },
    {
      "attribute_name": "Performance",
      "driver_ids": [
        "BD-9"
      ],
      "children": [
        {
          "scenario_id": "RS-2",
          "refinement": "Speed of operation processing",
          "scenario_description": "When the system processes operations, it processes them in the fastest possible speed.",
          "stimulus": "The system processes operations",
          "environment": "During normal operation",
          "response": "The system processes them in the fastest possible speed",
          "response_measure": null,
          "response_measure_basis": "missing",
          "priority_tuple": null,
          "priority_basis": null,
          "origin": "raw_candidate_scenario",
          "raw_scenario_id": "RS-2",
          "source_refs": [
            "evaluation_inputs.raw_candidate_scenarios[1]"
          ]
        }
      ]
    },
    {
      "attribute_name": "Reliability",
      "driver_ids": [
        "BD-7"
      ],
      "children": [
        {
          "scenario_id": "RS-3",
          "refinement": "Immediate recovery after failure",
          "scenario_description": "When a failure occurs, the system recovers immediately.",
          "stimulus": "A failure occurs",
          "environment": "During system operation",
          "response": "The system recovers immediately",
          "response_measure": null,
          "response_measure_basis": "missing",
          "priority_tuple": null,
          "priority_basis": null,
          "origin": "raw_candidate_scenario",
          "raw_scenario_id": "RS-3",
          "source_refs": [
            "evaluation_inputs.raw_candidate_scenarios[2]"
          ]
        },
        {
          "scenario_id": "RS-13",
          "refinement": "Consistent behavior of the architecture",
          "scenario_description": "When the architecture is exercised, it exhibits consistent behavior.",
          "stimulus": "The architecture is exercised",
          "environment": "During normal use",
          "response": "The architecture exhibits consistent behavior",
          "response_measure": null,
          "response_measure_basis": "missing",
          "priority_tuple": null,
          "priority_basis": null,
          "origin": "raw_candidate_scenario",
          "raw_scenario_id": "RS-13",
          "source_refs": [
            "evaluation_inputs.raw_candidate_scenarios[12]"
          ]
        },
        {
          "scenario_id": "RS-14",
          "refinement": "Correct and complete behavior",
          "scenario_description": "When the framework is used, it is complete, clear and performs exactly as required.",
          "stimulus": "The framework is used",
          "environment": "During normal operation",
          "response": "The framework is complete, clear and performs exactly as required",
          "response_measure": null,
          "response_measure_basis": "missing",
          "priority_tuple": null,
          "priority_basis": null,
          "origin": "raw_candidate_scenario",
          "raw_scenario_id": "RS-14",
          "source_refs": [
            "evaluation_inputs.raw_candidate_scenarios[13]"
          ]
        }
      ]
    },
    {
      "attribute_name": "Modifiability",
      "driver_ids": [
        "BD-10"
      ],
      "children": [
        {
          "scenario_id": "RS-5",
          "refinement": "Accommodation of new functionality demands",
          "scenario_description": "When new demands arise, the system accommodates them.",
          "stimulus": "New demands arise on the system",
          "environment": "After deployment",
          "response": "The system accommodates the new demands",
          "response_measure": null,
          "response_measure_basis": "missing",
          "priority_tuple": null,
          "priority_basis": null,
          "origin": "raw_candidate_scenario",
          "raw_scenario_id": "RS-5",
          "source_refs": [
            "evaluation_inputs.raw_candidate_scenarios[4]"
          ]
        },
        {
          "scenario_id": "RS-6",
          "refinement": "Reusability of major framework parts",
          "scenario_description": "When future projects are developed, major parts of the framework are reusable.",
          "stimulus": "Future projects are developed",
          "environment": "For future use",
          "response": "Major parts of the framework are reusable",
          "response_measure": null,
          "response_measure_basis": "missing",
          "priority_tuple": null,
          "priority_basis": null,
          "origin": "raw_candidate_scenario",
          "raw_scenario_id": "RS-6",
          "source_refs": [
            "evaluation_inputs.raw_candidate_scenarios[5]"
          ]
        },
        {
          "scenario_id": "RS-7",
          "refinement": "Fast and cost-effective framework modification",
          "scenario_description": "When the framework is modified, the modification is cost-effective, fast and in minimal time.",
          "stimulus": "The framework is modified",
          "environment": "During maintenance",
          "response": "The modification is cost-effective, fast and in minimal time",
          "response_measure": null,
          "response_measure_basis": "missing",
          "priority_tuple": null,
          "priority_basis": null,
          "origin": "raw_candidate_scenario",
          "raw_scenario_id": "RS-7",
          "source_refs": [
            "evaluation_inputs.raw_candidate_scenarios[6]"
          ]
        },
        {
          "scenario_id": "RS-9",
          "refinement": "Expansion to support more sophisticated options",
          "scenario_description": "When the framework is expanded, it allows more sophisticated options.",
          "stimulus": "The framework is expanded",
          "environment": "In the future",
          "response": "The framework allows more sophisticated options",
          "response_measure": null,
          "response_measure_basis": "missing",
          "priority_tuple": null,
          "priority_basis": null,
          "origin": "raw_candidate_scenario",
          "raw_scenario_id": "RS-9",
          "source_refs": [
            "evaluation_inputs.raw_candidate_scenarios[8]"
          ]
        },
        {
          "scenario_id": "RS-10",
          "refinement": "Execution in different environments",
          "scenario_description": "When the implementation is deployed, it can execute in different environments.",
          "stimulus": "The implementation is deployed",
          "environment": "In different environments",
          "response": "The implementation executes in different environments",
          "response_measure": null,
          "response_measure_basis": "missing",
          "priority_tuple": null,
          "priority_basis": null,
          "origin": "raw_candidate_scenario",
          "raw_scenario_id": "RS-10",
          "source_refs": [
            "evaluation_inputs.raw_candidate_scenarios[9]"
          ]
        },
        {
          "scenario_id": "RS-12",
          "refinement": "Implementation flexibility across programming languages",
          "scenario_description": "When the implementation is developed, it allows flexible implementation using other programming languages.",
          "stimulus": "The implementation is developed",
          "environment": "For future implementation choices",
          "response": "The implementation allows flexible use of other programming languages",
          "response_measure": null,
          "response_measure_basis": "missing",
          "priority_tuple": null,
          "priority_basis": null,
          "origin": "raw_candidate_scenario",
          "raw_scenario_id": "RS-12",
          "source_refs": [
            "evaluation_inputs.raw_candidate_scenarios[11]"
          ]
        },
        {
          "scenario_id": "RS-15",
          "refinement": "Concurrent support for multiple applications",
          "scenario_description": "When multiple applications are hooked up to the framework at the same time, the framework supports them.",
          "stimulus": "Multiple applications are hooked up to the framework at the same time",
          "environment": "During future extension",
          "response": "The framework supports multiple applications at the same time",
          "response_measure": null,
          "response_measure_basis": "missing",
          "priority_tuple": null,
          "priority_basis": null,
          "origin": "raw_candidate_scenario",
          "raw_scenario_id": "RS-15",
          "source_refs": [
            "evaluation_inputs.raw_candidate_scenarios[14]"
          ]
        },
        {
          "scenario_id": "RS-16",
          "refinement": "Change of interface style from command-driven to window-based",
          "scenario_description": "When the interface is changed from command-driven to window-based, the framework supports the change.",
          "stimulus": "The interface changes from command-driven to window-based",